Count,Title,Description
1,Humour,L'humour est-il une valeur agile ? Certains le pensent.
2,Feedback,Le feedback est une des valeurs mise en avant par Extreme Programming.
2,Simplicité,La simplicité est une des valeurs mise en avant par Extreme Programming.
2,Confiance,La confiance est une des valeurs mise en avant par Scrum.
2,Transparence,La transparence est une des valeurs mise en avant par Scrum.
2,Courage,Le courage est une valeur partagée par Scrum et Extreme Programming.
2,Respect,Le respect est une valeur partagée par Scrum et Extreme Programming.
